<?xml version="1.0" encoding="UTF-8"?>
<a:acquisti xmlns:a="http://www.imperofiere.com" xmlns:xs="http://www.w3.org/2001/XMLSchema-instance" xs:schemaLocation="http://www.imperofiere.com acquisti.xsd">
	<tipologia id="adulti" descrizione="Per chiunque almeno 16 anni, permette l'accesso completo a tutti i padiglioni" prezzo="150">
		<acquisto username="lbianchi" datatime="2016-09-05T21:04:44">1</acquisto>
		<acquisto username="mrossi" datatime="2016-09-05T21:08:58">1</acquisto>
		<acquisto username="user" datatime="2016-09-05T21:10:31">1</acquisto>
		<acquisto username="admin" datatime="2016-09-05T21:19:06">1</acquisto>
	</tipologia>
	<tipologia id="ragazzi" descrizione="Riservato ai ragazzi al di sotto dei 16 anni, permette l'accesso completo a tutti i padiglioni" prezzo="25">
		<acquisto username="lbianchi" datatime="2016-09-05T21:04:44">2</acquisto>
		<acquisto username="mrossi" datatime="2016-09-05T21:08:58">2</acquisto>
	</tipologia>
	<tipologia id="bambini" descrizione="Riservato ai bambini al di sotto dei 3 anni, i quali devono essere accompagnati da un adulto" prezzo="5">
		<acquisto username="lbianchi" datatime="2016-09-05T21:04:44">5</acquisto>
		<acquisto username="mrossi" datatime="2016-09-05T21:08:58">1</acquisto>
		<acquisto username="user" datatime="2016-09-05T21:10:31">1</acquisto>
	</tipologia>
	<tipologia id="anziani" descrizione="Riservato alle persone che abbiano compiuto i 65 anni, permette l'accesso completo a tutti i padiglioni" prezzo="15">
		<acquisto username="lbianchi" datatime="2016-09-05T21:04:44">1</acquisto>
		<acquisto username="mrossi" datatime="2016-09-05T21:08:58">4</acquisto>
	</tipologia>
</a:acquisti>
